{
  "task_id": "auth-001",
  "subagent_id": "subagent-alpha",
  "check_timestamp": "2026-07-19T13:25:00Z",
  "completion_percentage": 95,
  "smart_scores": {
    "specific": {
      "score": 100,
      "evidence": "All requested functionality implemented: login, logout, token refresh endpoints. Auth middleware created and applied to protected routes.",
      "issues": []
    },
    "measurable": {
      "score": 90,
      "evidence": "All deliverables created. Tests passing with 92% coverage. Login/logout/refresh working end-to-end.",
      "issues": ["Coverage just above threshold, could be improved"]
    },
    "achievable": {
      "score": 95,
      "evidence": "Solution uses existing Express framework and JWT library. Code follows project conventions and is maintainable.",
      "issues": []
    },
    "relevant": {
      "score": 100,
      "evidence": "Directly addresses authentication requirement. Follows architectural patterns. No conflicts with existing code.",
      "issues": []
    },
    "time_bound": {
      "score": 90,
      "evidence": "Completed in 1.5 hours (under 2-hour limit). All tests passing.",
      "issues": ["Slightly faster than estimated, could have added more edge case tests"]
    }
  },
  "overall_score": 95,
  "deliverables_completed": [
    {
      "name": "auth-middleware.ts",
      "path": "src/middleware/auth.ts",
      "status": "complete",
      "evidence": "JWT verification middleware handles token validation, expiration, and user context extraction"
    },
    {
      "name": "auth-routes.ts",
      "path": "src/routes/auth.ts",
      "status": "complete",
      "evidence": "Login, logout, and refresh endpoints implemented with proper error handling"
    },
    {
      "name": "auth.test.ts",
      "path": "tests/auth.test.ts",
      "status": "complete",
      "evidence": "15 tests covering all endpoints, middleware, and edge cases"
    }
  ],
  "acceptance_criteria_met": [
    {
      "criterion": "POST /api/auth/login returns JWT token on valid credentials",
      "met": true,
      "evidence": "Test: auth.test.ts:12 - returns 200 with access_token and refresh_token"
    },
    {
      "criterion": "POST /api/auth/logout invalidates refresh token",
      "met": true,
      "evidence": "Test: auth.test.ts:28 - refresh token blacklisted after logout"
    },
    {
      "criterion": "GET /api/auth/refresh generates new access token",
      "met": true,
      "evidence": "Test: auth.test.ts:45 - returns new access_token with valid refresh_token"
    },
    {
      "criterion": "Protected routes return 401 without valid token",
      "met": true,
      "evidence": "Test: auth.test.ts:62 - returns 401 when Authorization header missing"
    },
    {
      "criterion": "All tests pass with >90% coverage",
      "met": true,
      "evidence": "npm test: 15/15 passing, coverage: 92.3%"
    }
  ],
  "issues_found": [
    {
      "severity": "minor",
      "description": "Test coverage is 92.3%, just above the 90% threshold",
      "resolution": "Could add more edge case tests for token expiration scenarios"
    }
  ],
  "test_results": {
    "tests_passed": true,
    "test_output": "PASS src/routes/auth.test.ts\n  ✓ login - returns token (12ms)\n  ✓ login - invalid credentials (8ms)\n  ✓ logout - invalidates refresh token (15ms)\n  ✓ refresh - returns new token (10ms)\n  ✓ refresh - invalid token (6ms)\n\nTest Suites: 1 passed, 1 total\nTests:       15 passed, 15 total",
    "coverage": 92.3,
    "lint_passed": true,
    "type_check_passed": true,
    "build_passed": true
  },
  "confidence_level": "high",
  "notes": "All core functionality implemented and tested. Solution follows existing patterns in the codebase. Ready for review.",
  "evidence": [
    {
      "type": "file",
      "description": "Auth middleware implementation",
      "path": "src/middleware/auth.ts",
      "content": "import jwt from 'jsonwebtoken';\n\nexport const authMiddleware = (req, res, next) => {\n  const token = req.headers.authorization?.split(' ')[1];\n  if (!token) {\n    return res.status(401).json({ error: 'No token provided' });\n  }\n  try {\n    const decoded = jwt.verify(token, process.env.JWT_SECRET);\n    req.user = decoded;\n    next();\n  } catch (error) {\n    return res.status(401).json({ error: 'Invalid token' });\n  }\n};"
    },
    {
      "type": "test_output",
      "description": "Test results showing all tests passing",
      "path": "stdout",
      "content": "PASS src/routes/auth.test.ts\n  15 tests passed"
    }
  ]
}